{
  "$schema": "https://json-schema.org/draft/2020-12/schema",
  "$id": "https://embeddpilot.dev/schema/register-ir.schema.json",
  "title": "EmbeddPilot Register-Map IR",
  "description": "Structured intermediate representation of a peripheral's register map. This is the single contract between extraction (producer) and codegen (consumer). Every field the driver touches MUST exist here; if it's not in the IR, the driver cannot reference it.",
  "type": "object",
  "required": ["peripheral", "base_address", "registers", "meta"],
  "additionalProperties": false,
  "properties": {
    "peripheral": {
      "type": "string",
      "description": "Peripheral name exactly as it appears in the datasheet (e.g., 'I2C0', 'SPI2')."
    },
    "base_address": {
      "type": "string",
      "pattern": "^0x[0-9A-Fa-f]+$",
      "description": "Base address of the peripheral register block in hex (e.g., '0x3FF53000')."
    },
    "register_size_bits": {
      "type": "integer",
      "enum": [8, 16, 32],
      "default": 32,
      "description": "Default register width in bits for this peripheral."
    },
    "registers": {
      "type": "array",
      "minItems": 1,
      "items": { "$ref": "#/$defs/register" },
      "description": "Ordered list of registers in this peripheral block."
    },
    "meta": {
      "$ref": "#/$defs/meta",
      "description": "Extraction metadata: source datasheet, tool version, timestamp."
    }
  },
  "$defs": {
    "register": {
      "type": "object",
      "required": ["name", "offset", "size_bits", "fields"],
      "additionalProperties": false,
      "properties": {
        "name": {
          "type": "string",
          "description": "Register name exactly as in datasheet (e.g., 'I2C_CR1', 'I2C_FIFO_DATA')."
        },
        "offset": {
          "type": "string",
          "pattern": "^0x[0-9A-Fa-f]+$",
          "description": "Offset from base_address in hex (e.g., '0x00', '0x04')."
        },
        "size_bits": {
          "type": "integer",
          "enum": [8, 16, 32],
          "description": "Width of this register in bits."
        },
        "reset_value": {
          "type": "string",
          "pattern": "^0x[0-9A-Fa-f]+$",
          "description": "Reset/default value in hex. Omit only if datasheet does not specify."
        },
        "description": {
          "type": "string",
          "description": "Brief description from the datasheet."
        },
        "fields": {
          "type": "array",
          "items": { "$ref": "#/$defs/bit_field" },
          "description": "Bit-field definitions within this register. May be empty for undocumented registers."
        },
        "confidence": {
          "$ref": "#/$defs/confidence"
        },
        "notes": {
          "type": "string",
          "description": "Free-text notes: ambiguities, cross-page discrepancies, errata references."
        }
      }
    },
    "bit_field": {
      "type": "object",
      "required": ["name", "bit_offset", "width", "access"],
      "additionalProperties": false,
      "properties": {
        "name": {
          "type": "string",
          "description": "Bit-field name exactly as in datasheet (e.g., 'PE', 'START', 'TXFIFO_WM')."
        },
        "bit_offset": {
          "type": "integer",
          "minimum": 0,
          "maximum": 31,
          "description": "LSB position of this field within the register (0-indexed)."
        },
        "width": {
          "type": "integer",
          "minimum": 1,
          "maximum": 32,
          "description": "Width of this field in bits."
        },
        "access": {
          "type": "string",
          "enum": ["RO", "WO", "RW", "RW1C", "RW1S", "W1", "RESERVED"],
          "description": "Access type: RO=read-only, WO=write-only, RW=read-write, RW1C=read/write-1-to-clear, RW1S=read/write-1-to-set, W1=write-once, RESERVED=do not touch."
        },
        "reset_value": {
          "type": "integer",
          "minimum": 0,
          "description": "Reset value of this specific field (decimal). Omit if not specified."
        },
        "description": {
          "type": "string",
          "description": "Brief description from the datasheet."
        },
        "enum_values": {
          "type": "object",
          "additionalProperties": { "type": "string" },
          "description": "Named constants for this field (e.g., {\"0\": \"Disabled\", \"1\": \"Enabled\"})."
        },
        "confidence": {
          "$ref": "#/$defs/confidence"
        },
        "notes": {
          "type": "string",
          "description": "Ambiguities, footnotes, or discrepancies found during extraction."
        }
      }
    },
    "confidence": {
      "type": "string",
      "enum": ["high", "medium", "low"],
      "default": "high",
      "description": "Extraction confidence. 'high'=unambiguous in datasheet. 'medium'=minor ambiguity (e.g., footnoted). 'low'=significant ambiguity (merged cells, conflicting sections) — MUST be human-reviewed before downstream use."
    },
    "meta": {
      "type": "object",
      "required": ["datasheet_source", "mcu_family", "mcu_part", "extraction_tool"],
      "additionalProperties": false,
      "properties": {
        "datasheet_source": {
          "type": "string",
          "description": "Datasheet filename or document ID (e.g., 'esp32_technical_reference_manual_en.pdf')."
        },
        "datasheet_version": {
          "type": "string",
          "description": "Datasheet revision/version if stated."
        },
        "mcu_family": {
          "type": "string",
          "description": "MCU family (e.g., 'ESP32', 'STM32F4')."
        },
        "mcu_part": {
          "type": "string",
          "description": "Specific part number (e.g., 'ESP32-WROOM-32', 'STM32F407VG')."
        },
        "extraction_tool": {
          "type": "string",
          "description": "Tool/agent that produced this IR."
        },
        "extraction_timestamp": {
          "type": "string",
          "format": "date-time",
          "description": "ISO 8601 timestamp of extraction."
        },
        "schema_version": {
          "type": "string",
          "const": "1.0.0",
          "description": "Version of this IR schema."
        }
      }
    }
  }
}
