{
  "peripheral": "I2C0",
  "base_address": "0x3FF53000",
  "register_size_bits": 32,
  "registers": [
    {
      "name": "I2C_SCL_LOW_PERIOD_REG",
      "offset": "0x0000",
      "size_bits": 32,
      "reset_value": "0x00000000",
      "description": "Configures the low level width of the SCL clock.",
      "fields": [
        {
          "name": "I2C_SCL_LOW_PERIOD",
          "bit_offset": 0,
          "width": 14,
          "access": "RW",
          "reset_value": 0,
          "description": "Configures for how long SCL remains low in master mode, in APB clock cycles.",
          "confidence": "high"
        }
      ],
      "confidence": "high"
    },
    {
      "name": "I2C_CTR_REG",
      "offset": "0x0004",
      "size_bits": 32,
      "reset_value": "0x00000003",
      "description": "Transmission configuration register.",
      "fields": [
        {
          "name": "I2C_SDA_FORCE_OUT",
          "bit_offset": 0,
          "width": 1,
          "access": "RW",
          "reset_value": 1,
          "description": "0: direct output; 1: open drain output.",
          "confidence": "high"
        },
        {
          "name": "I2C_SCL_FORCE_OUT",
          "bit_offset": 1,
          "width": 1,
          "access": "RW",
          "reset_value": 1,
          "description": "0: direct output; 1: open drain output.",
          "confidence": "high"
        },
        {
          "name": "I2C_SAMPLE_SCL_LEVEL",
          "bit_offset": 2,
          "width": 1,
          "access": "RW",
          "reset_value": 0,
          "description": "1: sample SDA on SCL low level; 0: sample SDA on SCL high level.",
          "confidence": "high"
        },
        {
          "name": "I2C_MS_MODE",
          "bit_offset": 4,
          "width": 1,
          "access": "RW",
          "reset_value": 0,
          "description": "Set to configure as I2C Master. Clear to configure as I2C Slave.",
          "enum_values": {
            "0": "Slave",
            "1": "Master"
          },
          "confidence": "high"
        },
        {
          "name": "I2C_TRANS_START",
          "bit_offset": 5,
          "width": 1,
          "access": "RW",
          "reset_value": 0,
          "description": "Set this bit to start sending the data in txfifo.",
          "confidence": "high"
        },
        {
          "name": "I2C_TX_LSB_FIRST",
          "bit_offset": 6,
          "width": 1,
          "access": "RW",
          "reset_value": 0,
          "description": "1: send data from LSB; 0: send data from MSB.",
          "confidence": "high"
        },
        {
          "name": "I2C_RX_LSB_FIRST",
          "bit_offset": 7,
          "width": 1,
          "access": "RW",
          "reset_value": 0,
          "description": "1: receive data from LSB; 0: receive data from MSB.",
          "confidence": "high"
        }
      ],
      "confidence": "high"
    },
    {
      "name": "I2C_SR_REG",
      "offset": "0x0008",
      "size_bits": 32,
      "reset_value": "0x00000000",
      "description": "Describes I2C work status.",
      "fields": [
        {
          "name": "I2C_ACK_REC",
          "bit_offset": 0,
          "width": 1,
          "access": "RO",
          "reset_value": 0,
          "description": "Stores the value of the received ACK bit.",
          "confidence": "high"
        },
        {
          "name": "I2C_SLAVE_RW",
          "bit_offset": 1,
          "width": 1,
          "access": "RO",
          "reset_value": 0,
          "description": "In slave mode, 1: master reads from slave; 0: master writes to slave.",
          "confidence": "high"
        },
        {
          "name": "I2C_TIME_OUT",
          "bit_offset": 2,
          "width": 1,
          "access": "RO",
          "reset_value": 0,
          "description": "When the I2C controller takes more than I2C_TIME_OUT clocks to receive a data bit, changes to 1.",
          "confidence": "high"
        },
        {
          "name": "I2C_ARB_LOST",
          "bit_offset": 3,
          "width": 1,
          "access": "RO",
          "reset_value": 0,
          "description": "When the I2C controller loses control of SCL line, changes to 1.",
          "confidence": "high"
        },
        {
          "name": "I2C_BUS_BUSY",
          "bit_offset": 4,
          "width": 1,
          "access": "RO",
          "reset_value": 0,
          "description": "1: I2C bus is busy transferring data; 0: I2C bus is idle.",
          "confidence": "high"
        },
        {
          "name": "I2C_SLAVE_ADDRESSED",
          "bit_offset": 5,
          "width": 1,
          "access": "RO",
          "reset_value": 0,
          "description": "High when configured as slave and address sent by master matches slave address.",
          "confidence": "high"
        },
        {
          "name": "I2C_BYTE_TRANS",
          "bit_offset": 6,
          "width": 1,
          "access": "RO",
          "reset_value": 0,
          "description": "Changes to 1 when one byte is transferred.",
          "confidence": "high"
        },
        {
          "name": "I2C_RXFIFO_CNT",
          "bit_offset": 8,
          "width": 6,
          "access": "RO",
          "reset_value": 0,
          "description": "Amount of data needed to be sent.",
          "confidence": "high"
        },
        {
          "name": "I2C_TXFIFO_CNT",
          "bit_offset": 18,
          "width": 6,
          "access": "RO",
          "reset_value": 0,
          "description": "Amount of received data in RAM.",
          "confidence": "high"
        },
        {
          "name": "I2C_SCL_MAIN_STATE_LAST",
          "bit_offset": 24,
          "width": 3,
          "access": "RO",
          "reset_value": 0,
          "description": "States of I2C module state machine.",
          "enum_values": {
            "0": "Idle",
            "1": "Address shift",
            "2": "ACK address",
            "3": "Rx data",
            "4": "Tx data",
            "5": "Send ACK",
            "6": "Wait ACK"
          },
          "confidence": "high"
        },
        {
          "name": "I2C_SCL_STATE_LAST",
          "bit_offset": 28,
          "width": 3,
          "access": "RO",
          "reset_value": 0,
          "description": "States of the state machine used to produce SCL.",
          "enum_values": {
            "0": "Idle",
            "1": "Start",
            "2": "Negative edge",
            "3": "Low",
            "4": "Positive edge",
            "5": "High",
            "6": "Stop"
          },
          "confidence": "high"
        }
      ],
      "confidence": "high"
    },
    {
      "name": "I2C_TO_REG",
      "offset": "0x000c",
      "size_bits": 32,
      "reset_value": "0x00000000",
      "description": "Timeout control register.",
      "fields": [
        {
          "name": "I2C_TIME_OUT_REG",
          "bit_offset": 0,
          "width": 20,
          "access": "RW",
          "reset_value": 0,
          "description": "Timeout for receiving a data bit in APB clock cycles.",
          "confidence": "high"
        }
      ],
      "confidence": "high"
    },
    {
      "name": "I2C_SLAVE_ADDR_REG",
      "offset": "0x0010",
      "size_bits": 32,
      "reset_value": "0x00000000",
      "description": "Configures the I2C slave address.",
      "fields": [
        {
          "name": "I2C_SLAVE_ADDR",
          "bit_offset": 0,
          "width": 15,
          "access": "RW",
          "reset_value": 0,
          "description": "When configured as I2C Slave, this field configures the slave address.",
          "confidence": "high"
        },
        {
          "name": "I2C_SLAVE_ADDR_10BIT_EN",
          "bit_offset": 31,
          "width": 1,
          "access": "RW",
          "reset_value": 0,
          "description": "Enables slave 10-bit addressing mode in master mode.",
          "confidence": "high"
        }
      ],
      "confidence": "high"
    },
    {
      "name": "I2C_RXFIFO_ST_REG",
      "offset": "0x0014",
      "size_bits": 32,
      "reset_value": "0x00000000",
      "description": "FIFO status register.",
      "fields": [
        {
          "name": "I2C_RXFIFO_START_ADDR",
          "bit_offset": 0,
          "width": 5,
          "access": "RO",
          "reset_value": 0,
          "description": "Offset address of the last received data, as described in nonfifo_rx_thres register.",
          "confidence": "high"
        },
        {
          "name": "I2C_RXFIFO_END_ADDR",
          "bit_offset": 5,
          "width": 5,
          "access": "RO",
          "reset_value": 0,
          "description": "Offset address of the last received data. Refreshes when RX_REC_FULL_INT or TRANS_COMPLETE_INT is generated.",
          "confidence": "high"
        },
        {
          "name": "I2C_TXFIFO_START_ADDR",
          "bit_offset": 10,
          "width": 5,
          "access": "RO",
          "reset_value": 0,
          "description": "Offset address of the first sent data, as described in nonfifo_tx_thres register.",
          "confidence": "high"
        },
        {
          "name": "I2C_TXFIFO_END_ADDR",
          "bit_offset": 15,
          "width": 5,
          "access": "RO",
          "reset_value": 0,
          "description": "Offset address of the last sent data. Refreshes when TX_SEND_EMPTY_INT or TRANS_COMPLETE_INT is generated.",
          "confidence": "high"
        }
      ],
      "confidence": "high"
    },
    {
      "name": "I2C_FIFO_CONF_REG",
      "offset": "0x0018",
      "size_bits": 32,
      "reset_value": "0x01554000",
      "description": "FIFO configuration register.",
      "fields": [
        {
          "name": "I2C_RXFIFO_FULL_THRHD",
          "bit_offset": 0,
          "width": 5,
          "access": "RW",
          "reset_value": 0,
          "description": "RX FIFO threshold in non-FIFO mode. When RX FIFO count > this value, RXFIFO_FULL_INT_RAW is valid.",
          "confidence": "high"
        },